component,role,planned_description,actual_lot_required,sds_required_before_shipping,hazard_or_handling_note
MEA witness coupon or equivalent electrode-window coupon,device-contact substrate/control surface,"Actual coupon material, geometry, and surface treatment must be recorded before shipment.",yes,vendor_dependent,No electronics need to be powered; disclose substrate material and any cleaning/sterilization residues.
Sodium alginate,hydrogel matrix,alginate_laminin_2pct_wv_caso4_dmem,yes,yes,Provide supplier SDS and lot; keep dry powder handling separate from hydrated coupon shipment notes.
Calcium sulfate dihydrate,ionic crosslinker,183 mM calcium sulfate dihydrate dispersed in 1x DMEM for gelation.,yes,yes,Provide supplier SDS and final preparation batch ID.
DMEM or DMEM/F12 / CL1-proxy medium,crosslinking and soak medium,Actual medium name and lot must be entered in H-A rows; no live cells are included.,yes,yes,Disclose all supplements if used; do not send biohazardous or cell-containing material.
PEDOT:PSS dispersion,conductive phase,"0.6 wt percent PEDOT:PSS lead, selected from the published neural-culture loading",yes,yes,"Provide supplier SDS, loading fraction, pre-rinse/conditioning record, and whether free dispersion is present in shipped aliquots."
Laminin or equivalent cell-adhesion cue,neural cell-contact cue retained above or within hydrogel,EHS laminin or equivalent laminin cue retained above or within the hydrogel,yes,yes,Disclose biological source if applicable; no live cells or human subject material should be included.
Acellular soak aliquots,media physicochemical test article,"Pre/post aliquots for pH, osmolality, conductivity, and appearance after 0 h, 24 h, and 72 h H-A soaks.",yes,vendor_dependent,"Confirm volume, container, temperature, and no-biohazard acceptance with vendor before shipment."
