wave,candidate_id,vendor_name,primary_send_method,primary_email,secondary_emails,phone,contact_url,quote_url,sample_submission_url,source_url,source_note,email_file,bundle_zip,bundle_sha256,outbox_send_status,tracker_contact_date,tracker_reply_date,tracker_decision,contact_plan_status,send_note
first_wave,pacific_biolabs_physicochemical,Pacific BioLabs Physicochemical Properties Testing,contact_form_or_quote_phone,,,510-964-9000,https://pacificbiolabs.com/contact/,https://pacificbiolabs.com/contact/,,https://pacificbiolabs.com/contact/,Official contact page lists contact form and 510-964-9000 for quotes and testing requests.,data/zrc_nd_phase_a_rfq_outbox/emails/pacific_biolabs_physicochemical_rfq_email.txt,data/zrc_nd_phase_a_rfq_outbox/vendor_packages/pacific_biolabs_physicochemical_zrc_nd_phase_a_rfq_bundle.zip,b00499c1a70ec472a11eb8d894c2a463d6cdd3bc3819011aeee203de8980ec3d,ready_to_send,,,pending_outreach,ready_to_send,Use the contact form first; ask whether the Phase A package can be handled as non-GLP exploratory physicochemical testing.
first_wave,sigmaaldrich_media_testing,MilliporeSigma Cell Culture Media Stability and Testing Services,service_page_or_technical_service,PSTechService@milliporesigma.com,PSClientCare@milliporesigma.com,1-800-325-3010; 1-800-221-1975; 1-866-CARE-811,https://www.sigmaaldrich.com/US/en/collections/offices,https://www.sigmaaldrich.com/US/en/services/testing/cell-culture-media-stability-and-testing-services,,https://www.sigmaaldrich.com/US/en/collections/offices,"Official offices/contact page lists U.S. customer service, technical service, and Process Solutions technical/commercial service contacts.",data/zrc_nd_phase_a_rfq_outbox/emails/sigmaaldrich_media_testing_rfq_email.txt,data/zrc_nd_phase_a_rfq_outbox/vendor_packages/sigmaaldrich_media_testing_zrc_nd_phase_a_rfq_bundle.zip,020855375daaa1e6afde37c0d84b3ecffe2ddaadb5ca88e44a02ed842ac3b8d2,ready_to_send,,,pending_outreach,ready_to_send,Use the service page/contact path first; ask to route the RFQ to cell culture media stability/testing or Process Solutions custom testing.
first_wave,the_osmolality_lab,The Osmolality Lab,email_or_contact_form,info@osmolab.com,billing@osmolab.com,385-323-5141,https://theosmolalitylab.com/contact-us/,https://theosmolalitylab.com/contact-us/,https://theosmolalitylab.com/submit-samples/,https://theosmolalitylab.com/contact-us/,Official contact page lists info@osmolab.com and 385.323.5141; submission page says to request a quote before sending samples.,data/zrc_nd_phase_a_rfq_outbox/emails/the_osmolality_lab_rfq_email.txt,data/zrc_nd_phase_a_rfq_outbox/vendor_packages/the_osmolality_lab_zrc_nd_phase_a_rfq_bundle.zip,29125cb54ad2a21b1b161a4ecf22ec430b6c4109d8c208c4bd931a607373406f,ready_to_send,,,pending_outreach,ready_to_send,Ask explicitly whether acellular neural-medium aliquots from regenerated-cellulose module exposures fit their sample policy and whether conductivity is available.
first_wave,jordi_labs_el_polymer,Jordi Labs Analytical Testing,contact_form_or_email,info@jordilabs.com,,508-966-1301,https://jordilabs.com/contact/,https://jordilabs.com/contact/,,https://jordilabs.com/contact/,"Official contact page lists info@jordilabs.com, 508-966-1301, and contact form.",data/zrc_nd_phase_a_rfq_outbox/emails/jordi_labs_el_polymer_rfq_email.txt,data/zrc_nd_phase_a_rfq_outbox/vendor_packages/jordi_labs_el_polymer_zrc_nd_phase_a_rfq_bundle.zip,9c91fd2364629fa9c84d200d10a6ef041e479bcac16a50dc70082a3bb31750c3,ready_to_send,,,pending_outreach,ready_to_send,Use as chemistry/E&L escalation or custom analytical feasibility; do not over-scope before Phase A identifies a chemical drift concern.
second_wave,intertek_china_healthcare_testing,Intertek China Healthcare and Medical Device Testing,contact_form_or_china_service_email,service.china@intertek.com,,,https://www.intertek.com.cn/contact/,https://www.intertek.com.cn/contact/,,https://www.intertek.com.cn/contact/,"Official China contact path should be used to route the RFQ to healthcare, materials, or medical-device testing; exact pH/osmolality/conductivity coverage must be confirmed.",,,,missing_outbox_row,,,,standby_secondary_wave,Use as APAC split-scope fallback; require run_id-level raw values and non-GLP exploratory scope.
second_wave,wuxi_apptec_medical_device_testing,WuXi AppTec Medical Device Testing,contact_form,,,,https://www.wuxiapptec.com/contact,https://www.wuxiapptec.com/contact,,https://www.wuxiapptec.com/contact,Use official contact routing for medical-device testing or chemistry/biocompatibility feasibility; do not assume Phase A media-panel coverage until technical review.,,,,missing_outbox_row,,,,standby_secondary_wave,Best as chemistry/E&L or biological escalation path after Phase A identifies material-blank risk.
second_wave,tuv_sud_china_medical_device_testing,TUV SUD China Medical Device Testing,contact_form,,,,https://www.tuvsud.cn/zh-cn/contact-us,https://www.tuvsud.cn/zh-cn/contact-us,,https://www.tuvsud.cn/zh-cn/contact-us,Use official China contact routing for medical-device testing or biocompatibility; exploratory Phase A scope requires confirmation.,,,,missing_outbox_row,,,,standby_secondary_wave,Use as second-wave regulatory/ISO route; ask whether non-GLP raw run_id-level testing can be scoped separately.
second_wave,pony_testing_medical_device,PONY Testing Medical Device and Life-Science Services,contact_form_or_service_inquiry,,,,https://www.ponytest.com/,https://www.ponytest.com/,,https://www.ponytest.com/,Use official site inquiry path to route custom medical-device or physicochemical testing; exact Phase A fit must be confirmed.,,,,missing_outbox_row,,,,standby_secondary_wave,Use as China-local broad screening fallback only if the response commits to raw sample-level values and source-file provenance.
